{
  "$schema": "https://json-schema.org/draft/2020-12/schema",
  "$id": "https://qhdalabs.example/cnvs/schemas/event.schema.json",
  "title": "CNVS Event",
  "type": "object",
  "additionalProperties": false,
  "required": [
    "schema_version", "event_id", "event_type", "title", "description",
    "start_time", "end_time", "location", "country", "coordinates",
    "entities", "status", "created_at", "updated_at"
  ],
  "properties": {
    "schema_version": { "const": "0.1" },
    "event_id": {
      "type": "string",
      "pattern": "^CNVS-EVT-[0-9]{4}-[0-9]{2}-[0-9]{2}-[0-9]{4}$"
    },
    "event_type": {
      "enum": [
        "MILITARY", "SABOTAGE", "CYBER", "MARITIME", "AVIATION",
        "INFRASTRUCTURE", "POLITICAL", "DIPLOMATIC", "ENERGY",
        "INDUSTRIAL", "NATURAL", "OTHER"
      ]
    },
    "title": { "type": "string", "minLength": 1 },
    "description": { "type": "string" },
    "start_time": { "type": ["string", "null"], "format": "date-time" },
    "end_time": { "type": ["string", "null"], "format": "date-time" },
    "location": { "type": ["string", "null"] },
    "country": { "type": ["string", "null"], "pattern": "^[A-Z]{2}$" },
    "coordinates": {
      "oneOf": [
        { "type": "null" },
        {
          "type": "array",
          "prefixItems": [
            { "type": "number", "minimum": -180, "maximum": 180 },
            { "type": "number", "minimum": -90, "maximum": 90 }
          ],
          "minItems": 2,
          "maxItems": 2
        }
      ]
    },
    "entities": { "type": "array", "items": { "type": "string" } },
    "status": { "enum": ["ACTIVE", "CLOSED", "MERGED"] },
    "created_at": { "type": "string", "format": "date-time" },
    "updated_at": { "type": "string", "format": "date-time" }
  }
}
