{
  "schema_version": "0.1",
  "event_id": "CNVS-EVT-2026-10-07-0001",
  "event_type": "MARITIME",
  "title": "Synthetic example: reported damage to a cargo vessel",
  "description": "A fictional training scenario used to demonstrate linked CNVS records.",
  "start_time": "2026-10-07T06:30:00Z",
  "end_time": null,
  "location": "Example Bay",
  "country": "PL",
  "coordinates": [18.6, 54.4],
  "entities": ["Example cargo vessel"],
  "status": "ACTIVE",
  "created_at": "2026-10-07T08:00:00Z",
  "updated_at": "2026-10-07T09:00:00Z"
}
